{
  "$schema": "../form-schema.json",
  "id": "employee-satisfaction-survey",
  "title": "Employee Satisfaction Survey",
  "description": "Annual employee satisfaction and engagement survey",
  "status": "published",
  "welcome_message": "Your feedback is important to us. This survey helps us understand your experience and improve our workplace. All responses are confidential.",
  "closing_message": "Thank you for sharing your feedback. Your responses will help us create a better workplace for everyone.",
  "sections": [
    {
      "id": "job-satisfaction",
      "title": "Job Satisfaction",
      "description": "How satisfied are you with your current role?",
      "position": 1,
      "questions": [
        {
          "id": "overall-satisfaction",
          "title": "I am satisfied with my current job",
          "question_type": "likert",
          "is_required": true,
          "position": 1
        },
        {
          "id": "role-clarity",
          "title": "My job responsibilities are clearly defined",
          "question_type": "likert",
          "is_required": true,
          "position": 2
        },
        {
          "id": "workload",
          "title": "My workload is manageable",
          "question_type": "likert",
          "is_required": true,
          "position": 3
        },
        {
          "id": "skills-utilization",
          "title": "I have opportunities to use my skills and abilities",
          "question_type": "likert",
          "is_required": true,
          "position": 4
        },
        {
          "id": "job-comments",
          "title": "Additional comments about your job satisfaction",
          "question_type": "textarea",
          "is_required": false,
          "position": 5
        }
      ]
    },
    {
      "id": "management",
      "title": "Management & Leadership",
      "description": "Your experience with management and leadership",
      "position": 2,
      "questions": [
        {
          "id": "direct-manager",
          "title": "My direct manager provides clear direction and feedback",
          "question_type": "likert",
          "is_required": true,
          "position": 1
        },
        {
          "id": "manager-support",
          "title": "I feel supported by my manager",
          "question_type": "likert",
          "is_required": true,
          "position": 2
        },
        {
          "id": "leadership-trust",
          "title": "I trust the senior leadership team",
          "question_type": "likert",
          "is_required": true,
          "position": 3
        },
        {
          "id": "communication",
          "title": "Leadership communicates effectively about company goals and changes",
          "question_type": "likert",
          "is_required": true,
          "position": 4
        }
      ]
    },
    {
      "id": "work-environment",
      "title": "Work Environment",
      "description": "Your workplace experience",
      "position": 3,
      "questions": [
        {
          "id": "team-collaboration",
          "title": "I enjoy working with my team",
          "question_type": "likert",
          "is_required": true,
          "position": 1
        },
        {
          "id": "workplace-culture",
          "title": "The workplace culture is positive and inclusive",
          "question_type": "likert",
          "is_required": true,
          "position": 2
        },
        {
          "id": "resources",
          "title": "I have the resources and tools I need to do my job well",
          "question_type": "likert",
          "is_required": true,
          "position": 3
        },
        {
          "id": "work-life-balance",
          "title": "I have a good work-life balance",
          "question_type": "likert",
          "is_required": true,
          "position": 4
        }
      ]
    },
    {
      "id": "growth-development",
      "title": "Growth & Development",
      "description": "Career development opportunities",
      "position": 4,
      "questions": [
        {
          "id": "career-opportunities",
          "title": "There are opportunities for career advancement",
          "question_type": "likert",
          "is_required": true,
          "position": 1
        },
        {
          "id": "professional-development",
          "title": "I receive adequate training and professional development",
          "question_type": "likert",
          "is_required": true,
          "position": 2
        },
        {
          "id": "feedback",
          "title": "I receive regular feedback on my performance",
          "question_type": "likert",
          "is_required": true,
          "position": 3
        },
        {
          "id": "learning-encouraged",
          "title": "Learning and development are encouraged",
          "question_type": "likert",
          "is_required": true,
          "position": 4
        }
      ]
    },
    {
      "id": "compensation-benefits",
      "title": "Compensation & Benefits",
      "description": "Your satisfaction with compensation and benefits",
      "position": 5,
      "questions": [
        {
          "id": "fair-compensation",
          "title": "I am fairly compensated for my work",
          "question_type": "likert",
          "is_required": true,
          "position": 1
        },
        {
          "id": "benefits-satisfaction",
          "title": "I am satisfied with the benefits package",
          "question_type": "likert",
          "is_required": true,
          "position": 2
        },
        {
          "id": "recognition",
          "title": "Good work is recognized and appreciated",
          "question_type": "likert",
          "is_required": true,
          "position": 3
        }
      ]
    },
    {
      "id": "overall-assessment",
      "title": "Overall Assessment",
      "description": "Your overall experience",
      "position": 6,
      "questions": [
        {
          "id": "recommend-employer",
          "title": "I would recommend this organization as a great place to work",
          "question_type": "likert",
          "is_required": true,
          "position": 1
        },
        {
          "id": "proud-to-work",
          "title": "I am proud to work for this organization",
          "question_type": "likert",
          "is_required": true,
          "position": 2
        },
        {
          "id": "plan-to-stay",
          "title": "I plan to be working here in two years",
          "question_type": "likert",
          "is_required": true,
          "position": 3
        },
        {
          "id": "suggestions",
          "title": "What suggestions do you have for improving our workplace?",
          "question_type": "textarea",
          "is_required": false,
          "position": 4,
          "help_text": "Please share any ideas or concerns"
        }
      ]
    }
  ]
}